{
  "schemaVersion": 1,
  "rulesetVersion": "1.0.1",
  "name": "human-reviewed-technology-safety",
  "status": "shadow-only",
  "description": "Candidate only: corroborated Technology KEEP guards from human review; legacy rejects and active configuration unchanged.",
  "defaultReason": "KEEP: missing corroborating occupational body evidence",
  "predicates": [
    {
      "id": "support",
      "scope": "title",
      "pattern": "\\b(?:field(?: service)?|training device|pc support|electronic maintenance) technician\\b"
    },
    {
      "id": "erp-object",
      "scope": "body",
      "pattern": "\\b(?:sql|sap|erp|s/?4hana|financial system(?:s)? modules)\\b"
    },
    {
      "id": "erp-duty",
      "scope": "body",
      "pattern": "\\b(?:configur\\w*|troubleshoot\\w*|systems? (?:issues|modules)|data mapping|functional specifications?|integration testing)\\b"
    },
    {
      "id": "civil-title",
      "scope": "title",
      "pattern": "\\b(?:civil|roadway|bridge|geotechnical|drainage|structural)\\b"
    },
    {
      "id": "civil-object",
      "scope": "body",
      "pattern": "\\b(?:bridges?|roadways?|highways?|stormwater|storm sewers|culverts?|foundations?|concrete panels|steel structures|steel framing|landfills|excavations|erosion|sediment)\\b"
    },
    {
      "id": "civil-work",
      "scope": "body",
      "pattern": "\\b(?:design\\w*|construction|drawings?|calculations?|grading|hydraulic|geotechnical)\\b"
    },
    {
      "id": "core-title",
      "scope": "title",
      "pattern": "\\b(?:software|developer\\w*|programmer|devops|devsecops|full[- ]stack|back[- ]end|cloud|aws|azure|systems?|integration|automation|ai|ml|nlp|machine learning|network\\w*|cyber\\w*|database|gis|sysadmin|administrator|solution consultant)\\b|(?<!\\w)(?:\\.net|c#)(?!\\w)"
    },
    {
      "id": "electrical-title",
      "scope": "title",
      "pattern": "\\b(?:lighting|electrical|protection|controls|signals?)\\b"
    },
    {
      "id": "procurement-role",
      "scope": "title",
      "pattern": "\\bprocurement (?:agent|specialist)\\b"
    },
    {
      "id": "role-tech",
      "scope": "title",
      "pattern": "\\b(?:engineer\\w*|developer\\w*|programmer|architect|sysadmin|administrator|integration|devops|devsecops|automation|solution consultant)\\b"
    },
    {
      "id": "core-prefix",
      "scope": "titlePrefix",
      "pattern": "\\b(?:software|developer\\w*|programmer|devops|devsecops|full[- ]stack|back[- ]end|cloud|aws|azure|systems?|integration|automation|ai|ml|nlp|machine learning|network\\w*|cyber\\w*|database|gis|sysadmin|administrator|solution consultant)\\b|(?<!\\w)(?:\\.net|c#)(?!\\w)"
    },
    {
      "id": "protected-title",
      "scope": "title",
      "pattern": "\\b(?:engineer\\w*|developer\\w*|programmer|software|devops|devsecops|full[- ]stack|back[- ]end|front[- ]end|platform|cloud|aws|azure|systems?|integration|automation|ai|ml|nlp|machine learning|deep learning|network\\w*|cyber\\w*|database|data warehouse|gis|architect|sysadmin|administrator|technical program|solution consultant)\\b|(?<!\\w)(?:\\.net|c#)(?!\\w)"
    },
    {
      "id": "technical-duty",
      "scope": "body",
      "pattern": "\\b(?:develop\\w*|build\\w*|implement\\w*|program\\w*|administer\\w*|configur\\w*|debug\\w*|deploy\\w*|integrat\\w*|troubleshoot\\w*|maintain\\w*)\\b[^.!?;]{0,80}\\b(?:software|apis?|code|applications?|linux|windows server|servers?|networks?|kubernetes|sql|database|plc|cloud|python|csharp|c#|ci/cd)\\b",
      "ignorePattern": "\\b(?:talent pipelines?|recruit top.tier|professional network|practice network|cad software|consistent application|development and application|program controls|programmatic safety|programs within ms office|training application)\\b"
    },
    {
      "id": "clinical-title",
      "scope": "title",
      "pattern": "\\b(?:nurse|clinical|physician|therapist|dental|dietitian|psychiatric|mental health|social worker)\\b"
    },
    {
      "id": "clinical-body",
      "scope": "body",
      "pattern": "\\b(?:patient|patients|counseling|therapy|rehabilitation|medications|teeth)\\b"
    },
    {
      "id": "clinical-confirmed",
      "all": [
        "clinical-title",
        "clinical-body"
      ],
      "any": [],
      "none": []
    },
    {
      "id": "driving-title",
      "scope": "title",
      "pattern": "\\b(?:driver|truck|chauffeur)\\b"
    },
    {
      "id": "driving-body",
      "scope": "body",
      "pattern": "\\b(?:cdl|freight|deliver|delivery routes|tractor trailer|driving license)\\b"
    },
    {
      "id": "driving-confirmed",
      "all": [
        "driving-title",
        "driving-body"
      ],
      "any": [],
      "none": []
    },
    {
      "id": "trades-construction-title",
      "scope": "title",
      "pattern": "\\b(?:construction|civil|bridge|roadway|structural|electrician|plumber|welder|machinist|mechanic|inspector|cad operator)\\b"
    },
    {
      "id": "trades-construction-body",
      "scope": "body",
      "pattern": "\\b(?:construction|concrete|welding|weld|pipes|plumbing|wiring|machining|engines|aircraft|structural steel|bridge design)\\b"
    },
    {
      "id": "trades-construction-confirmed",
      "all": [
        "trades-construction-title",
        "trades-construction-body"
      ],
      "any": [],
      "none": []
    },
    {
      "id": "finance-title",
      "scope": "title",
      "pattern": "\\b(?:accountant|accounting|finance|financial|tax|payroll|auditor)\\b"
    },
    {
      "id": "finance-body",
      "scope": "body",
      "pattern": "\\b(?:accounting|financial statements|journal entries|tax|payroll|cost control|cost analysis|earned value|audits|audit|portfolios)\\b"
    },
    {
      "id": "finance-confirmed",
      "all": [
        "finance-title",
        "finance-body"
      ],
      "any": [],
      "none": []
    },
    {
      "id": "sales-title",
      "scope": "title",
      "pattern": "\\b(?:sales|account executive|business development|capture|pursuit lead)\\b"
    },
    {
      "id": "sales-body",
      "scope": "body",
      "pattern": "\\b(?:sales|revenue|quota|quotas|capture|pipeline|prospect|commercial|contracts)\\b"
    },
    {
      "id": "sales-confirmed",
      "all": [
        "sales-title",
        "sales-body"
      ],
      "any": [],
      "none": []
    },
    {
      "id": "hr-title",
      "scope": "title",
      "pattern": "\\b(?:hr|human resources|recruiter|recruiting|talent acquisition|compensation|staffing)\\b"
    },
    {
      "id": "hr-body",
      "scope": "body",
      "pattern": "\\b(?:hiring|recruitment|recruiting|candidates|employee relations|staffing|compensation|benefit policies)\\b"
    },
    {
      "id": "hr-confirmed",
      "all": [
        "hr-title",
        "hr-body"
      ],
      "any": [],
      "none": []
    },
    {
      "id": "hospitality-title",
      "scope": "title",
      "pattern": "\\b(?:cook|chef|housekeep\\w*|bartender|barista|restaurant server|food service|hotel front desk)\\b"
    },
    {
      "id": "hospitality-body",
      "scope": "body",
      "pattern": "\\b(?:food|kitchen|meals|guest rooms|linens|drinks|beverages|tables|cooking)\\b"
    },
    {
      "id": "hospitality-confirmed",
      "all": [
        "hospitality-title",
        "hospitality-body"
      ],
      "any": [],
      "none": []
    },
    {
      "id": "physical-security-title",
      "scope": "title",
      "pattern": "\\b(?:security guard|security officer|police|armed security|protective officer)\\b"
    },
    {
      "id": "physical-security-body",
      "scope": "body",
      "pattern": "\\b(?:patrol|patrolling|firearm|gates|guarding|premises|physical access)\\b"
    },
    {
      "id": "physical-security-confirmed",
      "all": [
        "physical-security-title",
        "physical-security-body"
      ],
      "any": [],
      "none": []
    },
    {
      "id": "operator-technician-title",
      "scope": "title",
      "pattern": "\\b(?:technician|operator|assembler|warehouse|material handler)\\b"
    },
    {
      "id": "operator-technician-body",
      "scope": "body",
      "pattern": "\\b(?:manufacturing|production parts|machinery|pallets|forklift|repair|repairs|aircraft|assembly|assemble|materials)\\b"
    },
    {
      "id": "operator-technician-confirmed",
      "all": [
        "operator-technician-title",
        "operator-technician-body"
      ],
      "any": [],
      "none": []
    },
    {
      "id": "business-other-title",
      "scope": "title",
      "pattern": "\\b(?:procurement|supply chain programs|product marketing|go.to.market|gtm|estimator|cost estimating|port captain)\\b"
    },
    {
      "id": "business-other-body",
      "scope": "body",
      "pattern": "\\b(?:procurement|supplier|suppliers|purchase|marketing|positioning|estimat\\w*|vessels|crewing|commercial)\\b"
    },
    {
      "id": "business-other-confirmed",
      "all": [
        "business-other-title",
        "business-other-body"
      ],
      "any": [],
      "none": []
    },
    {
      "id": "marketing-communications-title",
      "scope": "title",
      "pattern": "\\b(?:marketing (?:specialist|manager)|public relations)\\b"
    },
    {
      "id": "marketing-communications-body",
      "scope": "body",
      "pattern": "\\b(?:campaigns?|press releases|media plans|marketing|messaging|go.to.market)\\b"
    },
    {
      "id": "marketing-communications-confirmed",
      "all": [
        "marketing-communications-title",
        "marketing-communications-body"
      ],
      "any": [],
      "none": []
    },
    {
      "id": "environment-field-title",
      "scope": "title",
      "pattern": "\\b(?:environmental (?:project|program) manager|archaeolog\\w*|omm\\b.*technician)\\b"
    },
    {
      "id": "environment-field-body",
      "scope": "body",
      "pattern": "\\b(?:groundwater|soil|remediation|nepa|wetlands|environmental sampling|archaeolog\\w*)\\b"
    },
    {
      "id": "environment-field-confirmed",
      "all": [